{
  "version": 1,
  "name": "TestPreset",
  "autoLoad" : "No",
  "bindings": [
    { "labelName": "left", "messageType": "CC", "midiNumber": 0, "midiValue": 0, "midiChannelIndex": 0, "enabled": false },
    { "labelName": "right", "messageType": "CC", "midiNumber": 0, "midiValue": 0, "midiChannelIndex": 0, "enabled": false },
    { "labelName": "up", "messageType": "CC", "midiNumber": 0, "midiValue": 0, "midiChannelIndex": 0, "enabled": false },
    { "labelName": "down", "messageType": "CC", "midiNumber": 0, "midiValue": 0, "midiChannelIndex": 0, "enabled": false },
    { "labelName": "rec", "messageType": "CC", "midiNumber": 0, "midiValue": 0, "midiChannelIndex": 0, "enabled": false },
    { "labelName": "overdub", "messageType": "CC", "midiNumber": 0, "midiValue": 0, "midiChannelIndex": 0, "enabled": false },
    { "labelName": "stop", "messageType": "CC", "midiNumber": 0, "midiValue": 0, "midiChannelIndex": 0, "enabled": false },
    { "labelName": "play", "messageType": "CC", "midiNumber": 0, "midiValue": 0, "midiChannelIndex": 0, "enabled": false },
    { "labelName": "play-start", "messageType": "CC", "midiNumber": 0, "midiValue": 0, "midiChannelIndex": 0, "enabled": false },
    { "labelName": "main-screen", "messageType": "CC", "midiNumber": 0, "midiValue": 0, "midiChannelIndex": 0, "enabled": false },
    { "labelName": "prev-step-event", "messageType": "CC", "midiNumber": 0, "midiValue": 0, "midiChannelIndex": 0, "enabled": false },
    { "labelName": "next-step-event", "messageType": "CC", "midiNumber": 0, "midiValue": 0, "midiChannelIndex": 0, "enabled": false },
    { "labelName": "go-to", "messageType": "CC", "midiNumber": 0, "midiValue": 0, "midiChannelIndex": 0, "enabled": false },
    { "labelName": "prev-bar-start", "messageType": "CC", "midiNumber": 0, "midiValue": 0, "midiChannelIndex": 0, "enabled": false },
    { "labelName": "next-bar-end", "messageType": "CC", "midiNumber": 0, "midiValue": 0, "midiChannelIndex": 0, "enabled": false },
    { "labelName": "tap", "messageType": "CC", "midiNumber": 0, "midiValue": 0, "midiChannelIndex": 0, "enabled": false },
    { "labelName": "next-seq", "messageType": "CC", "midiNumber": 0, "midiValue": 0, "midiChannelIndex": 0, "enabled": false },
    { "labelName": "track-mute", "messageType": "CC", "midiNumber": 0, "midiValue": 0, "midiChannelIndex": 0, "enabled": false },
    { "labelName": "open-window", "messageType": "CC", "midiNumber": 0, "midiValue": 0, "midiChannelIndex": 0, "enabled": false },
    { "labelName": "full-level", "messageType": "CC", "midiNumber": 0, "midiValue": 0, "midiChannelIndex": 0, "enabled": false },
    { "labelName": "sixteen-levels", "messageType": "CC", "midiNumber": 0, "midiValue": 0, "midiChannelIndex": 0, "enabled": false },
    { "labelName": "f1", "messageType": "CC", "midiNumber": 0, "midiValue": 0, "midiChannelIndex": 0, "enabled": false },
    { "labelName": "f2", "messageType": "CC", "midiNumber": 0, "midiValue": 0, "midiChannelIndex": 0, "enabled": false },
    { "labelName": "f3", "messageType": "CC", "midiNumber": 0, "midiValue": 0, "midiChannelIndex": 0, "enabled": false },
    { "labelName": "f4", "messageType": "CC", "midiNumber": 0, "midiValue": 0, "midiChannelIndex": 0, "enabled": false },
    { "labelName": "f5", "messageType": "CC", "midiNumber": 0, "midiValue": 0, "midiChannelIndex": 0, "enabled": false },
    { "labelName": "f6", "messageType": "CC", "midiNumber": 0, "midiValue": 0, "midiChannelIndex": 0, "enabled": false },
    { "labelName": "shift", "messageType": "CC", "midiNumber": 0, "midiValue": 0, "midiChannelIndex": 0, "enabled": false },
    { "labelName": "enter", "messageType": "CC", "midiNumber": 0, "midiValue": 0, "midiChannelIndex": 0, "enabled": false },
    { "labelName": "undo-seq", "messageType": "CC", "midiNumber": 0, "midiValue": 0, "midiChannelIndex": 0, "enabled": false },
    { "labelName": "erase", "messageType": "CC", "midiNumber": 0, "midiValue": 0, "midiChannelIndex": 0, "enabled": false },
    { "labelName": "after", "messageType": "CC", "midiNumber": 0, "midiValue": 0, "midiChannelIndex": 0, "enabled": false },
    { "labelName": "bank-a", "messageType": "CC", "midiNumber": 0, "midiValue": 0, "midiChannelIndex": 0, "enabled": false },
    { "labelName": "bank-b", "messageType": "CC", "midiNumber": 0, "midiValue": 0, "midiChannelIndex": 0, "enabled": false },
    { "labelName": "bank-c", "messageType": "CC", "midiNumber": 0, "midiValue": 0, "midiChannelIndex": 0, "enabled": false },
    { "labelName": "bank-d", "messageType": "CC", "midiNumber": 0, "midiValue": 0, "midiChannelIndex": 0, "enabled": false },
    { "labelName": "0", "messageType": "CC", "midiNumber": 0, "midiValue": 0, "midiChannelIndex": 0, "enabled": false },
    { "labelName": "1", "messageType": "CC", "midiNumber": 0, "midiValue": 0, "midiChannelIndex": 0, "enabled": false },
    { "labelName": "2", "messageType": "CC", "midiNumber": 0, "midiValue": 0, "midiChannelIndex": 0, "enabled": false },
    { "labelName": "3", "messageType": "CC", "midiNumber": 0, "midiValue": 0, "midiChannelIndex": 0, "enabled": false },
    { "labelName": "4", "messageType": "CC", "midiNumber": 0, "midiValue": 0, "midiChannelIndex": 0, "enabled": false },
    { "labelName": "5", "messageType": "CC", "midiNumber": 0, "midiValue": 0, "midiChannelIndex": 0, "enabled": false },
    { "labelName": "6", "messageType": "CC", "midiNumber": 0, "midiValue": 0, "midiChannelIndex": 0, "enabled": false },
    { "labelName": "7", "messageType": "CC", "midiNumber": 0, "midiValue": 0, "midiChannelIndex": 0, "enabled": false },
    { "labelName": "8", "messageType": "CC", "midiNumber": 0, "midiValue": 0, "midiChannelIndex": 0, "enabled": false },
    { "labelName": "9", "messageType": "CC", "midiNumber": 0, "midiValue": 0, "midiChannelIndex": 0, "enabled": false },
    { "labelName": "pad-1", "messageType": "CC", "midiNumber": 0, "midiValue": 0, "midiChannelIndex": 0, "enabled": false },
    { "labelName": "pad-2", "messageType": "CC", "midiNumber": 0, "midiValue": 0, "midiChannelIndex": 0, "enabled": false },
    { "labelName": "pad-3", "messageType": "CC", "midiNumber": 0, "midiValue": 0, "midiChannelIndex": 0, "enabled": false },
    { "labelName": "pad-4", "messageType": "CC", "midiNumber": 0, "midiValue": 0, "midiChannelIndex": 0, "enabled": false },
    { "labelName": "pad-5", "messageType": "CC", "midiNumber": 0, "midiValue": 0, "midiChannelIndex": 0, "enabled": false },
    { "labelName": "pad-6", "messageType": "CC", "midiNumber": 0, "midiValue": 0, "midiChannelIndex": 0, "enabled": false },
    { "labelName": "pad-7", "messageType": "CC", "midiNumber": 0, "midiValue": 0, "midiChannelIndex": 0, "enabled": false },
    { "labelName": "pad-8", "messageType": "CC", "midiNumber": 0, "midiValue": 0, "midiChannelIndex": 0, "enabled": false },
    { "labelName": "pad-9", "messageType": "CC", "midiNumber": 0, "midiValue": 0, "midiChannelIndex": 0, "enabled": false },
    { "labelName": "pad-10", "messageType": "CC", "midiNumber": 0, "midiValue": 0, "midiChannelIndex": 0, "enabled": false },
    { "labelName": "pad-11", "messageType": "CC", "midiNumber": 0, "midiValue": 0, "midiChannelIndex": 0, "enabled": false },
    { "labelName": "pad-12", "messageType": "CC", "midiNumber": 0, "midiValue": 0, "midiChannelIndex": 0, "enabled": false },
    { "labelName": "pad-13", "messageType": "CC", "midiNumber": 0, "midiValue": 0, "midiChannelIndex": 0, "enabled": false },
    { "labelName": "pad-14", "messageType": "CC", "midiNumber": 0, "midiValue": 0, "midiChannelIndex": 0, "enabled": false },
    { "labelName": "pad-15", "messageType": "CC", "midiNumber": 0, "midiValue": 0, "midiChannelIndex": 0, "enabled": false },
    { "labelName": "pad-16", "messageType": "CC", "midiNumber": 0, "midiValue": 0, "midiChannelIndex": 0, "enabled": false },
    { "labelName": "datawheel", "messageType": "CC", "midiNumber": 0, "midiValue": 0, "midiChannelIndex": 0, "enabled": false },
    { "labelName": "datawheel-up", "messageType": "CC", "midiNumber": 0, "midiValue": 0, "midiChannelIndex": 0, "enabled": false },
    { "labelName": "datawheel-down", "messageType": "CC", "midiNumber": 0, "midiValue": 0, "midiChannelIndex": 0, "enabled": false },
    { "labelName": "slider", "messageType": "CC", "midiNumber": 0, "midiValue": 0, "midiChannelIndex": 0, "enabled": false },
    { "labelName": "rec-gain", "messageType": "CC", "midiNumber": 0, "midiValue": 0, "midiChannelIndex": 0, "enabled": false },
    { "labelName": "main-volume", "messageType": "CC", "midiNumber": 0, "midiValue": 0, "midiChannelIndex": 0, "enabled": false }
  ]
}
